{
  "contract_set_version": "1.1.0",
  "document_id": "inv_001",
  "source_file": "source.pdf",
  "page_count": 1,
  "pages": [
    {
      "page_number": 1,
      "width": 1275,
      "height": 1650,
      "rotation_detected": 0,
      "blocks": [
        {
          "block_id": "p1_b1",
          "block_type": "text",
          "bbox": [0, 0, 100, 100],
          "reading_order": 1,
          "text": "hello",
          "confidence": 0.99
        }
      ],
      "raw_ocr_lines": [
        {
          "line_id": "p1_l1",
          "bbox": [0, 0, 100, 50],
          "text": "hello",
          "confidence": 0.99
        }
      ]
    }
  ],
  "reading_order": ["p1_b1"],
  "document_text": "hello",
  "tables": [],
  "ingestion_sources": {
    "paddleocr_vl": {
      "enabled": true,
      "status": "success",
      "payload": { "kind": "structural" }
    },
    "falcon_ocr": {
      "enabled": false,
      "status": "not_implemented",
      "payload": null
    },
    "falcon_perception": {
      "enabled": false,
      "status": "not_implemented",
      "payload": null
    }
  },
  "perceptual_observations": {
    "status": "not_implemented",
    "logos": [],
    "stamps": [],
    "header_candidates": [],
    "footer_candidates": []
  },
  "candidate_vendor_signals": {
    "company_name": null,
    "addresses": [],
    "emails": [],
    "websites": [],
    "phones": [],
    "tax_ids": []
  }
}
